[
  {"terraformStage": "TerraformStage0-Barren", "planetNames": ["Prime", "Humble"], "startTerraformationIndex": 0, "stageName": "Barren"},
  {"terraformStage": "TerraformStage1-Bluesky", "planetNames": ["Prime", "Humble"], "startTerraformationIndex": 175000, "stageName": "Blue Sky"},
  {"terraformStage": "TerraformStage2-Clouds", "planetNames": ["Prime", "Humble"], "startTerraformationIndex": 350000, "stageName": "Clouds"},
  {"terraformStage": "TerraformStage3-Rain", "planetNames": ["Prime", "Humble"], "startTerraformationIndex": 875000, "stageName": "Rain"},
  {"terraformStage": "TerraformStage4-Water", "planetNames": ["Prime", "Humble"], "startTerraformationIndex": 3000000, "stageName": "Liquid Water"},
  {"terraformStage": "TerraformStage5-Lakes", "planetNames": ["Prime", "Humble"], "startTerraformationIndex": 50000000, "stageName": "Lakes"},
  {"terraformStage": "TerraformStage6-Moss", "planetNames": ["Prime", "Humble"], "startTerraformationIndex": 200000000, "stageName": "Moss"},
  {"terraformStage": "TerraformStage7-Herbs", "planetNames": ["Prime", "Humble"], "startTerraformationIndex": 700000000, "stageName": "Flora"},
  {"terraformStage": "TerraformStage8-Trees", "planetNames": ["Prime", "Humble"], "startTerraformationIndex": 2000000000, "stageName": "Trees"},
  {"terraformStage": "TerraformStage9-Insects", "planetNames": ["Prime", "Humble"], "startTerraformationIndex": 8000000000, "stageName": "Insects"},
  {"terraformStage": "TerraformStage10-Breathable", "planetNames": ["Prime", "Humble"], "startTerraformationIndex": 32000000000, "stageName": "Breathable atmosphere"},
  {"terraformStage": "TerraformStage11-Fish", "planetNames": ["Prime", "Humble"], "startTerraformationIndex": 120000000000, "stageName": "Fish"},
  {"terraformStage": "TerraformStage12-Amphibians", "planetNames": ["Prime", "Humble"], "startTerraformationIndex": 425000000000, "stageName": "Amphibians"},
  {"terraformStage": "TerraformStage13-Mammals", "planetNames": ["Prime", "Humble"], "startTerraformationIndex": 1250000000000, "stageName": "Mammals"},
  {"terraformStage": "TerraformStage14-Complete", "planetNames": ["Prime", "Humble"], "startTerraformationIndex": 4000000000000, "stageName": "Complete terraformation"},
  {"terraformStage": "Selenea-TerraformStage0-Barren", "planetNames": ["Selenea"], "startTerraformationIndex": 0, "stageName": "Barren"},
  {"terraformStage": "Selenea-TerraformStage1-WaterCycle", "planetNames": ["Selenea"], "startTerraformationIndex": 150000000, "stageName": "Water cycle"},
  {"terraformStage": "Selenea-TerraformStage2-Plants", "planetNames": ["Selenea"], "startTerraformationIndex": 1500000000, "stageName": "Vegetation"},
  {"terraformStage": "Selenea-TerraformStage3-ClearSky", "planetNames": ["Selenea"], "startTerraformationIndex": 20000000000, "stageName": "Clear sky"},
  {"terraformStage": "Selenea-TerraformStage4-Breathable", "planetNames": ["Selenea"], "startTerraformationIndex": 250000000000, "stageName": "Breathable atmosphere"},
  {"terraformStage": "Selenea-TerraformStage5-Life", "planetNames": ["Selenea"], "startTerraformationIndex": 1000000000000, "stageName": "Natural life"},
  {"terraformStage": "Selenea-TerraformStage6-Complete", "planetNames": ["Selenea"], "startTerraformationIndex": 5000000000000, "stageName": "Complete terraformation"},
  {"terraformStage": "Aqualis-TerraformStage0-Flooded", "planetNames": ["Aqualis"], "startTerraformationIndex": 0, "stageName": "Submerged"},
  {"terraformStage": "Aqualis-TerraformStage1-SeismicActivity", "planetNames": ["Aqualis"], "startTerraformationIndex": 10000000, "stageName": "Seismic activity"},
  {"terraformStage": "Aqualis-TerraformStage2-Corals", "planetNames": ["Aqualis"], "startTerraformationIndex": 200000000, "stageName": "Corals"},
  {"terraformStage": "Aqualis-TerraformStage3-SeismicShocks", "planetNames": ["Aqualis"], "startTerraformationIndex": 1000000000, "stageName": "Seismic shocks"},
  {"terraformStage": "Aqualis-TerraformStage4-WaterPlants", "planetNames": ["Aqualis"], "startTerraformationIndex": 9000000000, "stageName": "Water plants"},
  {"terraformStage": "Aqualis-TerraformStage5-Breathable", "planetNames": ["Aqualis"], "startTerraformationIndex": 100000000000, "stageName": "Breathable atmosphere"},
  {"terraformStage": "Aqualis-TerraformStage6-Life", "planetNames": ["Aqualis"], "startTerraformationIndex": 1100000000000, "stageName": "Natural life"},
  {"terraformStage": "Aqualis-TerraformStage7-Complete", "planetNames": ["Aqualis"], "startTerraformationIndex": 7000000000000, "stageName": "Complete terraformation"},
  {"terraformStage": "Toxicity-TerraformStage1-ToxicWasteland", "planetNames": ["Toxicity"], "startTerraformationIndex": 0, "stageName": "Toxic wasteland"},
  {"terraformStage": "Toxicity-TerraformStage2-ToxicDusts", "planetNames": ["Toxicity"], "startTerraformationIndex": 200000, "stageName": "Toxic dust"},
  {"terraformStage": "Toxicity-TerraformStage3-AcidRains", "planetNames": ["Toxicity"], "startTerraformationIndex": 500000, "stageName": "Acid rains"},
  {"terraformStage": "Toxicity-TerraformStage4-ToxicEruptions", "planetNames": ["Toxicity"], "startTerraformationIndex": 2000000, "stageName": "Toxic eruptions"},
  {"terraformStage": "Toxicity-TerraformStage5-ClearSky", "planetNames": ["Toxicity"], "startTerraformationIndex": 5000000, "stageName": "Clear sky"},
  {"terraformStage": "Toxicity-TerraformStage6-VegetationRenewal", "planetNames": ["Toxicity"], "startTerraformationIndex": 10000000, "stageName": "Vegetation renewal"},
  {"terraformStage": "Toxicity-TerraformStage7-CleanAtmosphere", "planetNames": ["Toxicity"], "startTerraformationIndex": 50000000, "stageName": "Purified atmosphere"},
  {"terraformStage": "Toxicity-TerraformStage8-CleanWaterCycle", "planetNames": ["Toxicity"], "startTerraformationIndex": 150000000, "stageName": "Purified water cycle"},
  {"terraformStage": "Toxicity-TerraformStage9-Plants", "planetNames": ["Toxicity"], "startTerraformationIndex": 1000000000, "stageName": "Vegetation"},
  {"terraformStage": "Toxicity-TerraformStage10-CleanOceans", "planetNames": ["Toxicity"], "startTerraformationIndex": 7000000000, "stageName": "Purified oceans"},
  {"terraformStage": "Toxicity-TerraformStage11-Insects", "planetNames": ["Toxicity"], "startTerraformationIndex": 45000000000, "stageName": "Insects"},
  {"terraformStage": "Toxicity-TerraformStage12-Breathable", "planetNames": ["Toxicity"], "startTerraformationIndex": 350000000000, "stageName": "Breathable atmosphere"},
  {"terraformStage": "Toxicity-TerraformStage13-Life", "planetNames": ["Toxicity"], "startTerraformationIndex": 1500000000000, "stageName": "Natural life"},
  {"terraformStage": "Toxicity-TerraformStage14-Complete", "planetNames": ["Toxicity"], "startTerraformationIndex": 6500000000000, "stageName": "Complete terraformation"},
  {"terraformStage": "Skeo-TerraformStage0-Dead", "planetNames": ["Skeo"], "startTerraformationIndex": 0, "stageName": "Dead planet"},
  {"terraformStage": "Skeo-TerraformStage1-IceMelting", "planetNames": ["Skeo"], "startTerraformationIndex": 350000000, "stageName": "Ice melting"},
  {"terraformStage": "Skeo-TerraformStage2-Monsoon", "planetNames": ["Skeo"], "startTerraformationIndex": 2000000000, "stageName": "Monsoon"},
  {"terraformStage": "Skeo-TerraformStage3-Savannah", "planetNames": ["Skeo"], "startTerraformationIndex": 35000000000, "stageName": "Savannah"},
  {"terraformStage": "Skeo-TerraformStage4-Breathable", "planetNames": ["Skeo"], "startTerraformationIndex": 750000000000, "stageName": "Breathable atmosphere"},
  {"terraformStage": "Skeo-TerraformStage5-Herds", "planetNames": ["Skeo"], "startTerraformationIndex": 2500000000000, "stageName": "Herds"},
  {"terraformStage": "Skeo-TerraformStage6-Complete", "planetNames": ["Skeo"], "startTerraformationIndex": 8000000000000, "stageName": "Complete terraformation"}
]
